{
  "schema_version": "0.1",
  "policy_version": "example-v1",
  "policy": {
    "capabilities": [
      "filesystem.read",
      "filesystem.write.scoped",
      "review.perform"
    ],
    "read_only_forbids": [
      "filesystem.write.scoped"
    ]
  },
  "roles": [
    {
      "contract": {
        "id": "implementer",
        "version": 1,
        "scope": "repository",
        "status": "active",
        "aliases": [],
        "mission": {
          "objective": "Propose the scoped change.",
          "responsibilities": [
            "Work only within the declared task."
          ],
          "out_of_scope": [
            "Runtime execution is not provided by this package."
          ],
          "success_criteria": [
            "Report evidence and unresolved items."
          ]
        },
        "contract": {
          "required_inputs": [
            "scope"
          ],
          "optional_inputs": [],
          "outputs": [
            "handoff"
          ],
          "output_schema": null,
          "acceptance_criteria": [
            "The task stays within its declared authority."
          ],
          "escalation_conditions": [
            "Escalate when authority or acceptance evidence is insufficient."
          ]
        },
        "authority": {
          "authority_mode": "write_scoped",
          "capabilities": [
            "filesystem.write.scoped"
          ],
          "prohibited_capabilities": [
            "review.perform"
          ],
          "allowed_write_scopes": [
            "src/**"
          ],
          "cannot": [
            "approve_own_implementation"
          ],
          "may_delegate_to": [
            "reviewer"
          ],
          "reports_to": null,
          "independence_requirements": [
            "A different declared role reviews the implementation."
          ]
        },
        "knowledge": {
          "required_knowledge": [],
          "optional_knowledge": [],
          "repository_context": [],
          "data_classification": [
            "public"
          ],
          "retention_policy": "No runtime memory is created by this checker."
        },
        "reasoning": {
          "reasoning_tier": "standard",
          "max_turn_class": "normal",
          "requires_independent_context": false
        }
      },
      "body": "# implementer\n\nThis is a fictional role. Follow the declared inputs and scope, and report uncertainty.\n"
    },
    {
      "contract": {
        "id": "reviewer",
        "version": 1,
        "scope": "repository",
        "status": "active",
        "aliases": [],
        "mission": {
          "objective": "Review evidence without changing the implementation.",
          "responsibilities": [
            "Work only within the declared task."
          ],
          "out_of_scope": [
            "Runtime execution is not provided by this package."
          ],
          "success_criteria": [
            "Report evidence and unresolved items."
          ]
        },
        "contract": {
          "required_inputs": [
            "scope"
          ],
          "optional_inputs": [],
          "outputs": [
            "handoff"
          ],
          "output_schema": null,
          "acceptance_criteria": [
            "The task stays within its declared authority."
          ],
          "escalation_conditions": [
            "Escalate when authority or acceptance evidence is insufficient."
          ]
        },
        "authority": {
          "authority_mode": "read_only",
          "capabilities": [
            "filesystem.read",
            "review.perform"
          ],
          "prohibited_capabilities": [
            "filesystem.write.scoped"
          ],
          "allowed_write_scopes": [],
          "cannot": [
            "approve_own_implementation"
          ],
          "may_delegate_to": [],
          "reports_to": null,
          "independence_requirements": [
            "A different declared role reviews the implementation."
          ]
        },
        "knowledge": {
          "required_knowledge": [],
          "optional_knowledge": [],
          "repository_context": [],
          "data_classification": [
            "public"
          ],
          "retention_policy": "No runtime memory is created by this checker."
        },
        "reasoning": {
          "reasoning_tier": "standard",
          "max_turn_class": "normal",
          "requires_independent_context": true
        }
      },
      "body": "# reviewer\n\nThis is a fictional role. Follow the declared inputs and scope, and report uncertainty.\n"
    }
  ],
  "knowledge": [],
  "routes": [
    {
      "task_type": "code-change",
      "accountable": "implementer",
      "executors": [
        "implementer"
      ],
      "reviewers": [
        "reviewer"
      ],
      "require_human_approval": true
    }
  ]
}
